{
    "name_medication": "Buscopan plus Paracetamol",
    "forgotten": "Setzen Sie die Einnahme zum nächsten Zeitpunkt fort. Nehmen Sie nicht die doppelte Menge ein, wenn Sie die vorherige Einnahme vergessen haben.",
    "quit": "Buscopan plus Paracetamol Filmtabletten werden nur bei Bedarf eingenommen und sollen nach Abklingen der Beschwerden abgesetzt werden. Ein plötzliches Absetzen von Schmerzmitteln wie Paracetamol nach längerer Anwendung in hoher Dosierung kann Entzugssymptome auslösen, die gewöhnlich innerhalb weniger Tage verschwinden. Eine erneute Einnahme von Schmerzmitteln darf nur nach entsprechender Anordnung des Arztes und nach Abklingen der Entzugserscheinungen erfolgen.",
    "too_much": "Wenn Sie mehr als die vorgeschriebene Dosis eingenommen haben oder ein Kind Filmtabletten geschluckt hat, verständigen Sie bitte unverzüglich einen Arzt, auch wenn noch keine Beschwerden bestehen. Halten Sie eine Packung des Arzneimittels bereit, damit sich der Arzt über die aufgenommenen Wirkstoffe informieren kann. Er wird über notwendige Maßnahmen entscheiden. Anzeichen einer Vergiftung mit Paracetamol treten in der Regel innerhalb von 24 Stunden auf und umfassen Übelkeit, Erbrechen, Appetitlosigkeit, Blässe und Unterleibsschmerzen. Eine Überdosierung kann bleibende Leberschäden verursachen, die zu Leberversagen, Blutungen im Magen-Darm-Trakt, Blutübersäuerung, Enzephalopathie, stark erhöhter Blutungsneigung, Koma und Tod führen können. Klinische Beschwerden der Leberschäden werden in der Regel nach 2 Tagen sichtbar und erreichen nach 4 bis 6 Tagen ein Maximum. Überdosierung kann auch zu Bauchspeicheldrüsenentzündung, akutem Nierenversagen, Störungen der Herzfunktion und Panzytopenie führen. Bei älteren Personen, Kleinkindern sowie Patienten mit eingeschränkter Leberfunktion, chronischem Alkoholkonsum oder chronischer Mangelernährung besteht ein erhöhtes Risiko einer Paracetamolvergiftung mit möglicherweise tödlichem Ausgang. Anzeichen einer Vergiftung mit Hyoscin-N-butylbromid können Harnverhaltung, Mundtrockenheit, beschleunigter Herzschlag, Hemmung der Darmbeweglichkeit, Benommenheit und vorübergehende Sehstörungen sein.",
    "max_intake_duration": "Ohne ärztliche Beratung sollen Buscopan plus Paracetamol 10 mg/500 mg Filmtabletten nicht länger als 3 Tage eingenommen werden.",
    "patient_instruction": "Nehmen Sie dieses Arzneimittel immer genau wie in dieser Packungsbeilage beschrieben bzw. genau nach Anweisung Ihres Arztes oder Apothekers ein. Die empfohlene Dosis für Erwachsene und Jugendliche über 12 Jahre beträgt 3 Mal täglich 1 Filmtablette. Im Bedarfsfall kann eine Einzelgabe von 2 Filmtabletten erfolgen. Eine Tageshöchstdosis von 4 Filmtabletten darf nicht überschritten werden. Der zeitliche Abstand soll mindestens 8 Stunden bis zur nächsten Anwendung betragen. Für ältere Patienten gelten die gleichen Dosierungsempfehlungen. Falls Sie an einer Störung der Leber- oder Nierenfunktion leiden, wird Ihr Arzt Ihnen möglicherweise eine geringere Dosis verordnen oder empfehlen, das Dosierungsintervall zu verlängern. Bei schweren Störungen der Leber- oder Nierenfunktion dürfen die Filmtabletten nicht eingenommen werden. Buscopan plus Paracetamol Filmtabletten werden aufgrund des hohen Gehaltes an Paracetamol nicht empfohlen für die Anwendung bei Kindern unter 12 Jahren. Für Jugendliche gelten die Dosierungsempfehlungen für Erwachsene.",
    "additional_instruction": "Die Filmtabletten sind unzerkaut mit ausreichend Flüssigkeit einzunehmen. Die Kerbe dient nicht zum Teilen der Tablette.",
    "route": "Zum Einnehmen.",
    "doseform": "Filmtablette",
    "dose_and_rate": "1",
    "max_dose_per_intake": "2",
    "max_dose_per_period": "4",
    "general_dosage": "Nehmen Sie dieses Arzneimittel immer genau wie in dieser Packungsbeilage beschrieben bzw. genau nach Anweisung Ihres Arztes oder Apothekers ein. Fragen Sie bei Ihrem Arzt oder Apotheker nach, wenn Sie sich nicht sicher sind. Die empfohlene Dosis für Erwachsene und Jugendliche über 12 Jahre beträgt 3 Mal täglich 1 Filmtablette. Im Bedarfsfall kann eine Einzelgabe von 2 Filmtabletten erfolgen. Eine Tageshöchstdosis von 4 Filmtabletten darf nicht überschritten werden. Der zeitliche Abstand soll mindestens 8 Stunden bis zur nächsten Anwendung betragen. Zum Einnehmen. Die Filmtabletten sind unzerkaut mit ausreichend Flüssigkeit einzunehmen. Die Kerbe dient nicht zum Teilen der Tablette. Spezielle Patientengruppen: Ältere Patienten: Für ältere Patienten gelten die gleichen Dosierungsempfehlungen. Patienten mit eingeschränkter Leber- oder Nierenfunktion: Falls Sie an einer Störung der Leber- oder Nierenfunktion leiden, wird Ihr Arzt Ihnen möglicherweise eine geringere Dosis verordnen oder empfehlen, das Dosierungsintervall (den zeitlichen Abstand zwischen zwei Einnahmen) zu verlängern. Bei schweren Störungen der Leber- oder Nierenfunktion dürfen Buscopan plus Paracetamol - Filmtabletten nicht eingenommen werden. Anwendungsdauer: Ohne ärztliche Beratung sollen Buscopan plus Paracetamol 10 mg/ 500 mg Filmtabletten nicht länger als 3 Tage eingenommen werden. Bitte sprechen Sie mit Ihrem Arzt oder Apotheker, wenn Sie den Eindruck haben, dass die Wirkung von Buscopan plus Paracetamol Filmtabletten zu stark oder zu schwach ist. Anwendung bei Kindern und Jugendlichen: Buscopan plus Paracetamol 10 mg/ 500 mg Filmtabletten werden aufgrund des hohen Gehaltes an Paracetamol nicht empfohlen für die Anwendung bei Kindern unter 12 Jahren. Für Jugendliche gelten die Dosierungsempfehlungen für Erwachsene. Wenn Sie eine größere Menge von Buscopan plus Paracetamol eingenommen haben, als Sie sollten: Wenn Sie mehr als die vorgeschriebene Dosis (zu viele Filmtabletten) eingenommen haben oder ein Kind Filmtabletten geschluckt hat, verständigen Sie bitte unverzüglich einen Arzt, auch wenn noch keine Beschwerden bestehen! Halten Sie eine Packung des Arzneimittels bereit, damit sich der Arzt über die aufgenommenen Wirkstoffe informieren kann. Er wird über notwendige Maßnahmen entscheiden. Anzeichen einer Vergiftung mit Paracetamol: In der Regel treten Beschwerden innerhalb von 24 Stunden auf: Übelkeit, Erbrechen, Appetitlosigkeit, Blässe und Unterleibsschmerzen. Danach kann es zu einer Besserung des Befindens kommen, es bleiben jedoch leichte Leibschmerzen als Hinweis auf eine Leberschädigung. Eine Überdosierung mit Paracetamol kann bleibende Leberschäden verursachen, die in weiterer Folge zu Leberversagen, Blutungen im Magen-Darm-Trakt, Blutübersäuerung und Enzephalopathie (nicht entzündliche Erkrankungen des Gehirns), stark erhöhter Blutungsneigung, Koma und Tod führen können. Klinische Beschwerden der Leberschäden werden in der Regel nach 2 Tagen sichtbar und erreichen nach 4 bis 6 Tagen ein Maximum. Überdosierung kann auch zu Bauchspeicheldrüsenentzündung, akutem Nierenversagen, Störungen der Herzfunktion und Panzytopenie (stark verringerte Zahl aller Blutzellen verbunden mit Schwäche, erhöhter Anfälligkeit für Infektionen und vermehrten Blutergüssen) führen. Bei älteren Personen und Kleinkindern sowie Patienten mit eingeschränkter Leberfunktion, chronischem Alkoholkonsum oder chronischer Mangelernährung und bei Patienten, die gleichzeitig mit den Leberstoffwechsel anregenden Arzneimitteln behandelt werden, besteht ein erhöhtes Risiko einer Paracetamolvergiftung mit möglicherweise tödlichem Ausgang. Anzeichen einer Vergiftung mit Hyoscin-N-butylbromid: Es kann zu Harnverhaltung, Mundtrockenheit, beschleunigtem Herzschlag, Hemmung der Darmbeweglichkeit, Benommenheit und vorübergehenden Sehstörungen (Störung der Anpassungsfähigkeit der Augen an unterschiedliche Entfernungen, Glaukomanfälle [Auslösung von grünem Star]) kommen. Wenn Sie die Einnahme von Buscopan plus Paracetamol vergessen haben: Setzen Sie die Einnahme zum nächsten Zeitpunkt fort. Nehmen Sie nicht die doppelte Menge ein, wenn Sie die vorherige Einnahme vergessen haben. Wenn Sie die Einnahme von Buscopan plus Paracetamol abbrechen: Buscopan plus Paracetamol Filmtabletten werden nur bei Bedarf eingenommen und sollen nach Abklingen der Beschwerden abgesetzt werden. Wenn Sie weitere Fragen zur Einnahme dieses Arzneimittels haben, wenden Sie sich an Ihren Arzt oder Apotheker.",
    "storage_guideline": "Buscopan plus Paracetamol sollte nicht über 30 °C gelagert werden und muss für Kinder unzugänglich aufbewahrt werden. Das Arzneimittel darf nach dem auf dem Umkarton angegebenen Verfalldatum nicht mehr verwendet werden, wobei das Verfalldatum sich auf den letzten Tag des angegebenen Monats bezieht. Entsorgen Sie das Arzneimittel nicht im Abwasser oder Haushaltsabfall, sondern fragen Sie Ihren Apotheker, wie es zu entsorgen ist, um zum Schutz der Umwelt beizutragen.",
    "characteristics": "Weiße, längliche, beiderseits nach außen gewölbte Filmtabletten mit einer Kerbe auf einer Seite. Beiderseits der Kerbe ist der Code „05B“ eingeprägt."
}