{
    "name_medication": "Pantoprazol Bluefish",
    "forgotten": "Nehmen Sie nicht die doppelte Menge ein, wenn Sie die vorherige Einnahme vergessen haben. Nehmen Sie einfach zum nächsten Einnahmezeitpunkt Ihre normale Dosis ein.",
    "quit": "Setzen Sie diese Tabletten nicht ab, ohne vorher darüber mit Ihrem Arzt oder Apotheker zu sprechen.",
    "too_much": "Informieren Sie Ihren Arzt oder Apotheker. Es sind keine Symptome einer Überdosierung bekannt.",
    "max_intake_duration": "Die Anwendungsdauer von Pantoprazol Bluefish variiert je nach Indikation. Bei der Behandlung von Refluxösophagitis beträgt die Behandlungsdauer in der Regel zwischen 4 und 8 Wochen. Bei Magengeschwüren liegt die Behandlungsdauer normalerweise zwischen 4 und 8 Wochen, während sie bei Zwölffingerdarmgeschwüren zwischen 2 und 4 Wochen beträgt. Für die Eradikationstherapie von Helicobacter pylori beträgt die übliche Behandlungsdauer eine bis zwei Wochen. Bei der Langzeittherapie des Zollinger-Ellison-Syndroms und anderer Erkrankungen, bei denen im Magen zu viel Säure produziert wird, wird die Dosis individuell angepasst, und der Arzt gibt an, wann die Behandlung beendet werden soll.",
    "patient_instruction": "Nehmen Sie Pantoprazol Bluefish immer genau nach Absprache mit Ihrem Arzt ein. Für Erwachsene und Jugendliche ab 12 Jahren zur Behandlung der Refluxösophagitis beträgt die übliche Dosis eine Tablette täglich, wobei der Arzt die Dosis auf zwei Tabletten täglich erhöhen kann. Bei der Behandlung von Infektionen mit Helicobacter pylori in Kombination mit zwei Antibiotika nehmen Erwachsene zweimal täglich eine Pantoprazol Tablette, jeweils 1 Stunde vor dem Frühstück und 1 Stunde vor dem Abendessen. Zur Behandlung von Magen- und Zwölffingerdarmgeschwüren beträgt die übliche Dosis eine Tablette täglich, mit der Möglichkeit der Verdopplung nach Absprache mit dem Arzt. Für die Langzeittherapie des Zollinger Ellison-Syndroms beträgt die empfohlene Anfangsdosis normalerweise zwei Tabletten täglich, eingenommen 1 Stunde vor einer Mahlzeit. Patienten mit schweren Leberproblemen sollten nicht mehr als eine Tablette 20 mg Pantoprazol täglich einnehmen. Pantoprazol Bluefish wird für Kinder unter 12 Jahren nicht empfohlen.",
    "additional_instruction": "Nehmen Sie die Tabletten 1 Stunde vor einer Mahlzeit ein, ohne sie zu zerkauen oder zu zerbrechen. Schlucken Sie die Tabletten als Ganzes mit etwas Wasser.",
    "route": "Zum Einnehmen.",
    "doseform": "Tabletten",
    "dose_and_rate": "1",
    "max_dose_per_intake": "2",
    "max_dose_per_period": "4",
    "general_dosage": "Nehmen Sie Pantoprazol Bluefish immer genau nach Absprache mit Ihrem Arzt ein. Fragen Sie bei Ihrem Arzt oder Apotheker nach, wenn Sie sich nicht sicher sind. Nehmen Sie die Tabletten 1 Stunde vor einer Mahlzeit ein, ohne sie zu zerkauen oder zu zerbrechen. Schlucken Sie die Tabletten als Ganzes mit etwas Wasser. Die empfohlene Dosis beträgt: Erwachsene und Jugendliche ab 12 Jahren zur Behandlung der Refluxösophagitis: Die übliche Dosis ist eine Tablette täglich. Ihr Arzt kann Ihnen raten, auf 2 Tabletten täglich zu erhöhen. Die Behandlungsdauer bei Refluxösophagitis beträgt in der Regel zwischen 4 und 8 Wochen. Ihr Arzt wird Ihnen sagen, wie lange Sie Ihr Arzneimittel einnehmen sollen. Erwachsene zur Behandlung von Infektionen mit dem Bakterium Helicobacter pylori bei Patienten mit Zwölffingerdarm- und Magengeschwüren, in Kombination mit zwei Antibiotika (Eradikationstherapie): Zweimal täglich eine Tablette plus zwei Antibiotika-Tabletten, entweder Amoxicillin oder Clarithromycin, und Metronidazol (oder Tinidazol), jeweils zweimal täglich zusammen mit der Pantoprazol Tablette. Nehmen Sie die erste Pantoprazol Tablette 1 Stunde vor dem Frühstück ein, die zweite Pantoprazol Tablette 1 Stunde vor dem Abendessen. Befolgen Sie alle Anweisungen Ihres Arztes und lesen Sie gründlich die Packungsbeilagen der Antibiotika. Die übliche Behandlungsdauer beträgt eine bis zwei Wochen. Zur Behandlung von Magen- und Zwölffingerdarmgeschwüren: Die übliche Dosis ist eine Tablette täglich. Nach Absprache mit Ihrem Arzt kann die Dosis verdoppelt werden. Ihr Arzt wird Ihnen sagen, wie lange Sie das Arzneimittel weiter einnehmen sollen. Die Behandlungsdauer bei Magengeschwüren beträgt in der Regel zwischen 4 und 8 Wochen. Die Behandlungsdauer bei Zwölffingerdarmgeschwüren beträgt in der Regel zwischen 2 und 4 Wochen. Zur Langzeittherapie des Zollinger Ellison-Syndroms und anderer Erkrankungen, bei denen im Magen zu viel Säure produziert wird: Die empfohlene Anfangsdosis ist normalerweise zwei Tabletten täglich. Nehmen Sie beide Tabletten 1 Stunde vor einer Mahlzeit ein. Je nachdem, wie viel Säure Ihr Magen produziert, wird Ihr Arzt möglicherweise die Dosis später noch anpassen. Wenn der Arzt Ihnen mehr als zwei Tabletten täglich verschrieben hat, sollten die Tabletten zweimal täglich eingenommen werden. Wenn der Arzt Ihnen eine Tagesdosis von mehr als vier Tabletten verschreibt, sagt er Ihnen genau, wann Sie wieder aufhören sollen, das Arzneimittel einzunehmen. Patienten mit Nierenproblemen: Wenn Sie Nierenprobleme haben, sollten Sie Pantoprazol Bluefish nicht zur Eradikation von Helicobacter pylori einnehmen. Patienten mit Leberproblemen: Wenn Sie an schweren Leberproblemen leiden, sollten Sie nicht mehr als eine Tablette 20 mg Pantoprazol täglich nehmen (hierfür sind Tabletten mit 20 mg Pantoprazol erhältlich). Wenn Sie mäßige oder schwere Leberprobleme haben, sollten Sie Pantoprazol Bluefish nicht zur Eradikation von Helicobacter pylori einnehmen. Anwendung bei Kindern und Jugendlichen: Diese Tabletten werden für Kinder unter 12 Jahren nicht empfohlen. Wenn Sie eine größere Menge von Pantoprazol Bluefish eingenommen haben, als Sie sollten, informieren Sie Ihren Arzt oder Apotheker. Es sind keine Symptome einer Überdosierung bekannt. Wenn Sie die Einnahme von Pantoprazol Bluefish vergessen haben, nehmen Sie nicht die doppelte Menge ein, wenn Sie die vorherige Einnahme vergessen haben. Nehmen Sie einfach zum nächsten Einnahmezeitpunkt Ihre normale Dosis ein. Wenn Sie die Einnahme von Pantoprazol Bluefish abbrechen, setzen Sie diese Tabletten nicht ab, ohne vorher darüber mit Ihrem Arzt oder Apotheker zu sprechen. Wenn Sie weitere Fragen zur Einnahme dieses Arzneimittels haben, wenden Sie sich an Ihren Arzt oder Apotheker.",
    "storage_guideline": "Pantoprazol Bluefish sollte nicht über 30º C gelagert werden und muss für Kinder unzugänglich aufbewahrt werden. Das Verfallsdatum ist auf der Verpackung nach „Verwendbar bis“ angegeben und bezieht sich auf den letzten Tag des angegebenen Monats. Verwenden Sie das Arzneimittel nach diesem Datum nicht mehr. Entsorgen Sie es nicht im Abwasser oder Haushaltsabfall, sondern fragen Sie Ihren Apotheker, wie es zu entsorgen ist, um die Umwelt zu schützen.",
    "characteristics": "Pantoprazol Bluefish 40 mg magensaftresistente Tabletten sind gelbe, ovale, bikonvexe und glatte Tabletten. Die Tablettengröße ist: Breite: 6,35 mm ± 0,32 mm (6,03 mm – 6,67 mm), Länge: 12,00 mm ± 0,60 mm (11,40 mm – 12,60 mm)."
}